	id	advertiser_type	advertiser_id	price	price_min	price_max	features	property_type	bathrooms	bedrooms	carspaces	region	suburb	postcode	address	latitude	longitude	headline	description	labels	listingSlug
88	2015755484	Agency	8176	$599,000	599000		['BuiltInWardrobes', 'SecureParking', 'Bath', 'Heating', 'Dishwasher', 'Study', 'Shed']	House	2.0	4.0	6	South Western Victoria	MEREDITH	3333	4 Watson Street, Meredith	-37.8458176	144.084488	Big Family home on Acreage - Meredith	"<b></b><br />With just over 2.5 acres of land here, the opportunity to make this your dream home is just too good to be true.  With an affordable price tag and a blank canvas, just imagine the possibilities.
With the master bedroom at the front of the..."	[]	4-watson-street-meredith-vic-3333-2015755484
89	2015907809	Agency	19254	$575,000 - $605,000 (Large Shedding)	575000	605000	['BuiltInWardrobes', 'Ensuite', 'SecureParking', 'Heating']	House	2.0	3.0	5	Melbourne Region	LANGWARRIN	3910	10 Monze Drive, Langwarrin	-38.1518936	145.20874	Ideal Family Home in Convenient Location	<b></b><br />Tucked away in a private location close to popular amenities stands this perfect entry level property. Offering an open style floorplan throughout with multiple zones, this property is an excellent example of a well-appointed and value for...	['Under offer']	10-monze-drive-langwarrin-vic-3910-2015907809
90	2015894643	Agency	25513	AUCTION	AUCTION	AUCTION	['Floorboards', 'SecureParking', 'NorthFacing', 'Heating', 'Dishwasher']	House	2.0	3.0	3	Melbourne Region	NOBLE PARK NORTH	3174	5 Jennifer Street, Noble Park North	-37.955452	145.192871	ENJOY SUMMER WITH THIS ENTERTAINER'S DREAM	<b></b><br />Entertain all year round with this fantastic three bedroom family home, offering you multiple Balinese-inspired outdoor areas. The home itself is a further delight, boasting a functional and flexible floorplan, as well as expansive living ...	['Auction Sat 14 Dec']	5-jennifer-street-noble-park-north-vic-3174-2015894643
91	2015883083	Agency	18426	CONTACT	CONTACT	CONTACT	['AirConditioning', 'BuiltInWardrobes', 'Gas', 'SecureParking', 'Bath', 'Heating', 'Shed', 'SolarPanels']	House	2.0	4.0	4	Melbourne Region	BELMONT	3216	3 Kent Court, Belmont	-38.1808968	144.338409	A Genuine Family Residence In a Perfect Position	"<b></b><br />Space and privacy set upon a generous allotment 750m2 (approx.) at end of Court location, adoringly maintained with an immaculate presentation.

Built-in the era when a home was pivotal to true family lifestyle and entertaining with spac..."	['Auction Sat 14 Dec']	3-kent-court-belmont-vic-3216-2015883083
92	2015387074	Agency	17140	$599,000	599000		['SwimmingPool', 'Dishwasher', 'Study', 'Shed']	House	2.0	4.0	5	South Eastern Victoria	LEONGATHA	3953	45-47 Roughead Street, Leongatha	-38.47189	145.949265	CIRCA 1920S	"<b></b><br />Californian bungalow set on a generous 1550m2 parcel of land on a corner block plus side lane access. 
Shining like a new penny, this home has been restored back to its original splendor with modern day advantages. High ceilings, picture ..."	[]	45-47-roughead-street-leongatha-vic-3953-2015387074
93	2015902126	Agency	30068	CONTACT	CONTACT	CONTACT	['BuiltInWardrobes', 'Ensuite', 'Floorboards', 'SecureParking', 'AlarmSystem', 'Heating', 'Shed', 'FullyFenced', 'GardenCourtyard']	House	2.0	4.0	4	Melbourne Region	DEER PARK	3023	29 Carroll Street, Deer Park	-37.7699547	144.762268	Safe & Spacious Family Home In The Quinn Estate!	"<b></b><br />Enjoy a smart and spacious floor plan with stunning floorboards throughout this 4-bedroom family home in the secure Quinn Estate!

Equipped with roller shutter windows and a security alarm system, this is a safe and well-connected living o..."	['Auction Sat 14 Dec']	29-carroll-street-deer-park-vic-3023-2015902126
94	2015755678	Agency	12612	$599,500 - $659,450	599500	659450	['SecureParking', 'Study', 'Shed']	House	2.0	5.0	4	Melbourne Region	CLIFTON SPRINGS	3222	16 Gwinganna Drive, Clifton Springs	-38.15246	144.581146	Contemporary Coastal Vibe	<b></b><br />This two-storey brick home, situated on a generous 702m² (approx), has been tastefully renovated and boasts a contemporary yet relaxed coastal aesthetic.  Upstairs the harbour views are captivating and the open plan living area is spacious...	[]	16-gwinganna-drive-clifton-springs-vic-3222-2015755678
95	2014421864	Agency	29204	$599,000 - $658,000	599000	658000	[]	House	3.0	5.0	4	Melbourne Region	EUMEMMERRING	3177	13 Llewelyn Place, Eumemmerring	-38.00075	145.2455	Potential rental yield around 6%	<b></b><br />When you are looking for a great investment opportunity with unlimited potential, you must be sure to come and have a look at this. With 3 varying opportunities to make money, or to just have one extra-large home the possibilities are endl...	[]	13-llewelyn-place-eumemmerring-vic-3177-2014421864
96	2015905901	Agency	23542	CONTACT	CONTACT	CONTACT	[]	House	2.0	4.0	4	South Western Victoria	SOUTHERN CROSS	3283	284 Southern Cross Road, Southern Cross	-38.30242	142.402908	A RARE OPPORTUNITY IN SOUTHERN CROSS	"<b></b><br />There are not many properties that come to the market in the picturesque Southwest Victoria town of Southern Cross.
Situated on approximately 2 acres this is a spacious 4 bedroom, 2 bathroom family home with extra garaging."	[]	284-southern-cross-road-southern-cross-vic-3283-2015905901
97	2015358450	Agency	5005	$599,000 - $649,000	599000	649000	['AirConditioning', 'BuiltInWardrobes', 'Ensuite', 'Floorboards', 'Gas', 'SecureParking', 'Dishwasher', 'Study']	House	2.0	3.0	5	Melbourne Region	WHITTINGTON	3219	2 Koala Court, Whittington	-38.1797867	144.386536	Approved plans & permits.	<b></b><br />Situated on a 1,166m2 (approx.) block within walking distance to local shopping centres, schools, public transport, medical facilities & all major amenities within easy reach. This well designed two story home with three bedrooms (all with...	[]	2-koala-court-whittington-vic-3219-2015358450
98	2015738866	Agency	18314	$599,000 - $655,000	599000	655000	['BuiltInWardrobes', 'Gas', 'SecureParking', 'Dishwasher', 'Study']	House	2.0	5.0	6	Melbourne Region	GROVEDALE	3216	8 Allambee Avenue, Grovedale	-38.20711	144.321014	Family Living With North-Facing Backyard & Parkland Views!	"<b></b><br />Boasting a spacious layout and north-facing backyard with direct access to Coolabah Park, this home puts the elements in place for great family living! 
Family-friendly locations don't get much better than this. The Heyers Road shops are ..."	['Under offer']	8-allambee-avenue-grovedale-vic-3216-2015738866
99	2015810153	Agency	11693	4 BEDROOM FAMILY HOME	4		['Heating']	House	2.0	4.0	6	Melbourne Region	HOPPERS CROSSING	3029	57 Baggott Drive, Hoppers Crossing	-37.8722267	144.690567	Nest or invest!	<b></b><br />This warm and very well-maintained four bedrooms double storey brick veneer home is ideal for first home buyers or astute investor, it comprises of a  formal lounge, kitchen/ meals area with an adjacent large family room, also boasting fou...	[]	57-baggott-drive-hoppers-crossing-vic-3029-2015810153
0	2014690694	Agency	12645	$595,000	595000		['BuiltInWardrobes', 'Ensuite', 'Floorboards', 'SecureParking', 'Furnished', 'Shed', 'FullyFenced']	House	2.0	4.0	6	South Eastern Victoria	SANDY POINT	3959	8 ANDERSON AVENUE, Sandy Point	-38.8316727	146.132965	The best of beachside living!	<b></b><br />Brilliantly updated and extended to offer every feature you could possibly want in a beach house.  Set on a flat fully fenced 725m2 block with parking for multiple cars, caravans, boats plus a large lock up shed. Huge open plan living room...	[]	8-anderson-avenue-sandy-point-vic-3959-2014690694
1	2015523650	Agency	26896	$595,000 - $645,000	595000	645000	['BuiltInWardrobes', 'Ensuite', 'Gas', 'SecureParking', 'GroundFloor', 'Bath', 'Heating', 'Dishwasher']	House	3.0	4.0	3	South Western Victoria	SEBASTOPOL	3356	72 Albert Street, Sebastopol	-37.5881	143.840622	Two Immaculate Homes for the Price of One	<b></b><br />This extremely rare and unique opportunity exists to secure two immaculate homes on one title offering many possibilities to suit the growing family, live in one, rent the other out, run your own air B n B, get rid of the kids or even a fa...	[]	72-albert-street-sebastopol-vic-3356-2015523650
2	2015155161	Agency	5904	$595,000	595000		['AirConditioning', 'BuiltInWardrobes', 'Ensuite', 'Gas', 'SecureParking', 'CityViews', 'Bath', 'Heating', 'Dishwasher', 'Study', 'Shed']	House	2.0	4.0	6	Northern Victoria	CAMPBELLS CREEK	3451	9 Moscript  Street, Campbells Creek	-37.08308	144.205139	ENJOY A BEAUTIFUL INTERIOR, OVER-SIZED GARDEN AND AMAZING WORKSHOP!	<b></b><br />Light filled and spacious, this four bedroom home offers its new owners plenty of space to move both inside and out. The home sits on a huge 2365m2 allotment that features terraced garden beds, a return driveway and a massive 16 by 6 shed ...	[]	9-moscript-street-campbells-creek-vic-3451-2015155161
3	2015628243	Agency	11919	$595,000 - $650,000	595000	650000	['AirConditioning', 'BuiltInWardrobes', 'Ensuite', 'Gas', 'SecureParking', 'BroadbandInternetAccess', 'Bath', 'Heating', 'Dishwasher', 'FullyFenced', 'GardenCourtyard']	House	2.0	3.0	3	Melbourne Region	ROSEBUD	3939	69a Potton Avenue, Rosebud	-38.36654	144.910309	Low Maintenance Living In A Peaceful Location	<b></b><br />This modern, low set brick home is situated on a beautiful, quiet street. Maximising abundant natural light, the family residence has been created to meet the highest standards of modern family living. Meticulously maintained with quality ...	[]	69a-potton-avenue-rosebud-vic-3939-2015628243
4	2014685102	Agency	15133	$595,000	595000		[]	House	2.0	3.0	5	South Eastern Victoria	BAIRNSDALE	3875	14 Jones Bay  Drive, Bairnsdale	-37.8363876	147.6596	SECURE YOUR OWN PIECE OF PARADISE	<b></b><br />Located only a very short drive to town on over five acres (approx.), and boasting a stunning aspect overlooking Jones Bay, is your very own private slice of tranquility. The beautiful, contemporary home consists of three bedrooms, two bat...	[]	14-jones-bay-drive-bairnsdale-vic-3875-2014685102
5	2015525276	Agency	8548	$595,000	595000		['AirConditioning', 'BuiltInWardrobes', 'Gas', 'Bath', 'Heating', 'Dishwasher', 'Study', 'Shed', 'SolarPanels']	House	3.0	4.0	10	South Eastern Victoria	PORT ALBERT	3971	6 Wellington Street, Port Albert	-38.6721039	146.68808	PORT ALBERT-Views, Views, Views!	"<b></b><br />This is an outstanding quality built home situated on the foreshore of the Nooramunga Marine Park, which offers comfortable living and an easy walk to the shops, cafes and galleries which Port Albert offers.
The home has two levels- the f..."	[]	6-wellington-street-port-albert-vic-3971-2015525276
6	2015619540	Agency	26262	$595,000	595000		['Gas', 'Study', 'Shed']	House	2.0	4.0	4	Northern Victoria	MANSFIELD	3722	75 Cambridge Drive, Mansfield	-37.046154	146.096008	WELL BUILT FAMILY HOME IN A GREAT LOCATION!	<b></b><br />Boasting a Northern aspect rear garden with a lovely rural outlook, this deceptively spacious home was custom built by a local builder for their own family and boasts 4 big bedrooms plus a study, open plan living and of course a great shed...	[]	75-cambridge-drive-mansfield-vic-3722-2015619540
7	2015917564	Agency	20759	$595,000 - $630,000	595000	630000	['AirConditioning', 'BuiltInWardrobes', 'Ensuite', 'SecureParking', 'Heating', 'Shed', 'DoubleGlazedWindows']	House	2.0	4.0	4	Northern Victoria	HUNTLY	3551	823 Midland Highway, Huntly	-36.65148	144.349014	Quality Family Home with Perfect Presentation!	"<b></b><br />Features we love about this pristine property!
-4 Bedrooms main with ensuite and WIR
other bedrooms with BIR's
-Large open plan kitchen/dining/lounge
-2 Living areas
-Bathroom/Laundry
-Refrigerated air conditioning
-Double glazed wi..."	[]	823-midland-highway-huntly-vic-3551-2015917564
8	2015183119	Agency	10282	$595,000 - $650,000	595000	650000	['AirConditioning', 'SwimmingPool', 'Heating', 'Dishwasher', 'Shed', 'FullyFenced']	House	2.0	4.0	7	Northern Victoria	CHEWTON	3451	734 Pyrenees Hwy, Chewton	-37.0839462	144.2699	Family Home,4 Bedroom,Indoor Pool on 3 acres	"<b></b><br />Phone enquiry code for this property: 2057

Set at the back of the property amongst beautifully established native gardens, this warm and inviting family home draws you in. The craftsman-built brick home, of generous proportions maximize..."	[]	734-pyrenees-hwy-chewton-vic-3451-2015183119
9	2015834593	Agency	5904	$595,000 - $620,000	595000	620000	['AirConditioning', 'BuiltInWardrobes', 'Ensuite', 'SecureParking', 'Bath', 'Heating', 'SolarPanels']	House	2.0	4.0	4	Northern Victoria	STRATHDALE	3550	6 Hillary Court, Strathdale	-36.77423	144.316132	PREMIUM LOCALE OFFERS A RELAXED LIFESTYLE & CONVENIENCE	"<b></b><br />Offering a relaxed lifestyle of luxury and location, this single level, four bedroom, two bathroom home is set in a sought after enclave and matches space with class and quality.
Showcasing generous proportions both inside and out, high c..."	[]	6-hillary-court-strathdale-vic-3550-2015834593
10	2015300633	Agency	12645	$595,000	595000		['BuiltInWardrobes', 'Ensuite', 'SecureParking', 'Shed']	House	3.0	5.0	7	South Eastern Victoria	STONY CREEK	3957	39 Main St, Stony Creek	-38.58932	146.041168	Resort style living in quiet rural location	<b></b><br />This superbly appointed residence has been brilliantly designed for a modern lifestyle - filled with natural light and offering spacious entertaining areas that flow from inside to outdoors. Relax, revitalise and entertain in style no matt...	[]	39-main-st-stony-creek-vic-3957-2015300633
11	2015686674	Agency	7125	$595,000	595000		['Gas', 'SecureParking', 'Intercom', 'Heating', 'Dishwasher']	House	2.0	4.0	3	Melbourne Region	WOLLERT	3750	10 Greyfriars Lane, Wollert	-37.6145325	145.04361	STYLISH AND IMPRESSIVE - NEARLY NEW	<b></b><br />From the moment you step inside, you will immediately appreciate the obvious level of quality and craftsmanship that extends through every aspect of this beautifully presented, near new family home. Set amongst peaceful, picturesque surrou...	[]	10-greyfriars-lane-wollert-vic-3750-2015686674
12	2015461136	Agency	22037	$595,000 - $620,000	595000	620000	[]	House	2.0	4.0	5	Northern Victoria	KENNINGTON	3550	22-24 Edwards Road, Kennington	-36.7683868	144.30603	ATTENTION DEVELOPERS AND INVESTORS	"<b></b><br />* As a result of a Deceased Estate, a very rare opportunity is presented for your consideration. 
* Located in the Blue Chip Kennington area and only metres from schools, Latrobe University, shopping precinct, hotels, cafes and much more,..."	['Under offer']	22-24-edwards-road-kennington-vic-3550-2015461136
13	2014407028	Agency	11693	6 Bedroom Family Home	6		['AirConditioning', 'Heating']	House	2.0	6.0	4	Melbourne Region	ST ALBANS	3021	255 Sunshine Avenue, St Albans	-37.7326126	144.817154	6 BEDROOM FAMILY HOME!	<b></b><br />Take a look at this opportunity, a perfectly presented home set on approximately 603 m2. Explore the future possibilities, Suitable for the largest of families, whether you choose to occupy, invest, rent or possibly subdivide (STCA) the ho...	[]	255-sunshine-avenue-st-albans-vic-3021-2014407028
14	2015308074	Agency	30303	CONTACT	CONTACT	CONTACT	['AirConditioning', 'BuiltInWardrobes', 'Ensuite', 'SecureParking', 'Heating', 'Shed', 'SolarPanels']	House	2.0	4.0	4	Melbourne Region	BROOKFIELD	3338	4 Ross Crt, Brookfield	-37.6931572	144.561951	Magnificent Double Storey Home on a 790m2 Block of Land	"<b></b><br />Magnificent Double Storey Home on a 790m2 Block of Land

4 ROSS COURT, BROOKFIELD

361 Degrees Real Estate Agency is proud to present this magnificent property that is nestled on approximately 790m2 of land and located in one of the be..."	[]	4-ross-crt-brookfield-vic-3338-2015308074
15	2015828592	Agency	20379	$590,000 - $640,000	590000	640000	['AirConditioning', 'BuiltInWardrobes', 'Ensuite', 'Heating']	House	2.0	4.0	4	Melbourne Region	HOPPERS CROSSING	3029	8 Hyslop Street, Hoppers Crossing	-37.8764648	144.689331	Offered For Sale For The First Time And In The MOSSFIEL ESTATE	"<b></b><br />It is with great honour and pride that we at Barry Plant Tarneit have been appointed by our sellers to present to the market place, 8 Hyslop Street Hoppers Crossing.

This ONE owner property offers every luxury you would expect when buyi..."	[]	8-hyslop-street-hoppers-crossing-vic-3029-2015828592
16	2015927710	Agency	15213	$590,000 - $640,000	590000	640000	['Ensuite', 'Heating', 'Shed', 'SolarPanels']	House	2.0	4.0	4	Northern Victoria	YEA	3717	8 Matheson Street, Yea	-37.2168541	145.421768	Entertain The Family	"<b></b><br />Often sought but rarely found, is this brick veneer house situated on 890 SQM (approx.). With established gardens, located in a sought-after area in Yea, awaits this opportunity for the discerning buyer.
This house features four spacious ..."	[]	8-matheson-street-yea-vic-3717-2015927710
17	2015744477	Agency	30890	$590,000 - $610,000	590000	610000	['AirConditioning', 'BuiltInWardrobes', 'Ensuite', 'Gas', 'SecureParking', 'Heating', 'Dishwasher', 'Study']	House	2.0	4.0	4	Melbourne Region	CRANBOURNE	3977	13 Broadleaf Way, Cranbourne	-38.0850372	145.287537	BRILLIANT FAMILY HOME!	<b></b><br />CRANBOURNE: The Carlisle Park Estate, in the heart of Cranbourne, is best known for its lush parks, excellent sporting facilities, outstanding schools, friendly neighborhood and unbeatable accessibility. And this lovely house in the Carlis...	[]	13-broadleaf-way-cranbourne-vic-3977-2015744477
18	2014976920	Agency	8001	$590,000	590000		['SecureParking', 'Heating', 'Study']	House	2.0	4.0	8	South Eastern Victoria	TRARALGON	3844	2 Nicholas Court, Traralgon	-38.19904	146.5678	All the Room You Will Ever Want	"<b></b><br />- Impressive four-bedroom home with a variety of living zones on a 1300m2 Ellavale block
- Huge master suite with walk in robe and full bathroom. Three further up stairs bedrooms all with robes. 
- Three separate living zones plus open p..."	[]	2-nicholas-court-traralgon-vic-3844-2014976920
19	2015906264	Agency	15886	$589,000	589000		['Ensuite', 'SecureParking', 'Heating', 'DoubleGlazedWindows', 'SolarPanels']	House	2.0	4.0	3	South Eastern Victoria	NEERIM SOUTH	3831	7 Benjamin Street, Neerim South	-38.0207062	145.951965	Picturesque Views With Ample Boat & Caravan Storage	<b></b><br />Ideally set within walking distance from the Neerim South township, this beautifully presented sandstone property could be exactly what you're looking for. Featuring 4 spacious bedrooms, 2 bathrooms (ensuite to main), open plan kitchen and...	[]	7-benjamin-street-neerim-south-vic-3831-2015906264
20	2015711585	Agency	16716	$589,000	589000		['BuiltInWardrobes', 'Gas', 'SecureParking', 'Heating', 'Dishwasher', 'Shed', 'SolarPanels']	House	3.0	5.0	3	Northern Victoria	SHEPPARTON NORTH	3631	3 Grammar Crt, Shepparton North	-36.3298645	145.41423	1 Acre, Great Location.	<b></b><br />This wonderful family home on 1acre is well positioned in a quiet, prime location. Only walking distance to the GV Grammar School, it features 5 bedrooms, 3 bathrooms and 2 generous living areas, providing plenty of room for the whole fami...	[]	3-grammar-crt-shepparton-north-vic-3631-2015711585
21	2014942895	Agency	21617	$589,000 - $619,000	589000	619000	['Floorboards', 'SecureParking', 'Heating', 'Study']	House	2.0	5.0	4	South Western Victoria	ELLIMINYT	3250	49 Dowling Street, Elliminyt	-38.36728	143.59317	PRICE DROP - VENDORS KEEN TO SELL!	"<b></b><br />Located on a quiet, almost ½ acre elevated site in Elliminyt, this property offers an excellent lifestyle choice for a range of potential owners.

Within easy reach of Elliminyt School, Kindergarten, Joiner Reserve and the Golf & Turf Cl..."	[]	49-dowling-street-elliminyt-vic-3250-2014942895
22	2015853882	Agency	5904	$589,000	589000		['BuiltInWardrobes', 'Ensuite', 'Gas', 'SecureParking', 'Heating', 'Study']	House	2.0	4.0	3	Northern Victoria	CASTLEMAINE	3450	1 Alfred Drive, Castlemaine	-37.0673828	144.192459	GREAT SPACE, GREAT STYLE ON ALFRED DRIVE	<b></b><br />This super stylish and deceptively spacious brick home in positioned on a 725m2 allotment in a developed part of Castlemaine and features a large covered alfresco area with north eastern views towards town and a landscaped native garden. T...	[]	1-alfred-drive-castlemaine-vic-3450-2015853882
23	2015720190	Agency	3309	$585,000	585000		['SecureParking', 'NorthFacing']	House	2.0	4.0	4	South Western Victoria	PORTLAND	3305	2-6 Trangmar Street, Portland	-38.3559837	141.593781	Something very special	<b></b><br />Prepare to be surprised apon inspection of this beautiful property. Located only a short walk to town and beaches via the Fawthrop Lagoon and a stones throw to 3 primary schools and a secondary school, you have all the convience of town li...	[]	2-6-trangmar-street-portland-vic-3305-2015720190
24	2015777135	Agency	10282	$585,000 - $615,000	585000	615000	['AirConditioning', 'BuiltInWardrobes', 'CableOrSatellite', 'Ensuite', 'Gas', 'SecureParking', 'Heating', 'Dishwasher', 'Shed', 'FullyFenced', 'SolarPanels']	House	2.0	4.0	3	Melbourne Region	LEOPOLD	3224	13 Pickworth Drive, Leopold	-38.1917419	144.4614	Spacious home in great location with lots of extras	"<b></b><br />Phone enquiry code for this property: 3003

This great 4-bedroom home with fully fitted studio/workshop also has a large under-cover entertainment area. 
The studio/workshop is fully lined, painted and carpeted, with reverse cycle air c..."	[]	13-pickworth-drive-leopold-vic-3224-2015777135
25	2015221442	Agency	31874	$585,000 - $615,000	585000	615000	['AirConditioning', 'Ensuite', 'Gas', 'SecureParking', 'Bath', 'Dishwasher', 'Study', 'Shed', 'SolarPanels']	House	3.0	5.0	3	Melbourne Region	LEOPOLD	3224	7 Stringers Lane, Leopold	-38.18335	144.46022	When Location is Key	<b></b><br />This remarkable home is situated on an impressive 594m2 approx. allotment in a central location like no other. Ideally positioned within walking distance to all amenities; Leopold Sporting precinct, the Gateway Plaza, Leopold Primary Schoo...	['Under offer']	7-stringers-lane-leopold-vic-3224-2015221442
26	2015914579	Agency	13462	$585,000	585000		['AirConditioning', 'Ensuite', 'Floorboards', 'SecureParking', 'Bath', 'Dishwasher', 'Study', 'Shed']	House	2.0	3.0	4	South Western Victoria	KOROIT	3282	465 Koroit - Port Fairy Road, Koroit	-38.3107147	142.347382	A 5 Acre Beauty on Tower Hill!	<b></b><br />Sitting in the fringe of Tower Hill, just a short drive to the township of Koroit, this home rests on a beautiful five acres (approx.) of land and is perfect for those who are seeking the lifestyle of a hobby farm without being too far awa...	[]	465-koroit-port-fairy-road-koroit-vic-3282-2015914579
27	2014873804	Agency	11863	$590,000 - $620,000	590000	620000	['AirConditioning', 'BuiltInWardrobes', 'Ensuite', 'Gas', 'SecureParking', 'SwimmingPool', 'GroundFloor', 'Bath', 'Heating', 'Dishwasher', 'Study', 'Shed', 'FullyFenced']	House	2.0	4.0	3	Northern Victoria	JACKASS FLAT	3556	13 Buxton Street, Jackass Flat	-36.7147636	144.2823	THE JEWEL OF THE SUBURBS!	<b></b><br />Proudly presenting the epitome of family living in the suburbs!! Built in 2017 and only just 18 months young, this Dennis Family home represents the complete package, and comes gift wrapped and ready with absolutely nothing else to do! If ...	[]	13-buxton-street-jackass-flat-vic-3556-2014873804
28	2015322605	Agency	4596	$575,000 - $585,000	575000	585000	['AirConditioning', 'BuiltInWardrobes', 'Ensuite', 'SecureParking', 'SwimmingPool', 'Heating', 'Dishwasher', 'Study', 'Shed']	House	2.0	3.0	4	Northern Victoria	MAIDEN GULLY	3551	11 Janelle Drive, Maiden Gully	-36.7490921	144.21022	MAIDEN GULLY MASTERPIECE	<b></b><br />Located on a large 1553sqm allotment in popular Maiden Gully and surrounded by quality new homes, this well-presented, one-owner home is a standout. The owners clearly have an eye for style and were thinking outside the square when they de...	[]	11-janelle-drive-maiden-gully-vic-3551-2015322605
29	2015400344	Agency	21617	$580,000	580000		['Ensuite', 'Heating', 'Study']	House	2.0	4.0	3	South Western Victoria	COLAC	3250	116 Marriner Street, Colac	-38.328083	143.620972	Views, views, and unlimited potential	<b></b><br />It's impossible to not focus on the spectacular views from this brilliant, two-story family home. The north-facing property captures views across Lake Colac and beyond that you only imagine, unless you're actually sitting inside or on the ...	[]	116-marriner-street-colac-vic-3250-2015400344
30	2015835220	Agency	30746	CONTACT	CONTACT	CONTACT	['AirConditioning', 'BuiltInWardrobes', 'Ensuite', 'SecureParking', 'Heating', 'Study']	House	2.0	4.0	4	Melbourne Region	LARA	3212	7 Benetti Drive, Lara	-38.033577	144.400558	FAMILY HOME WITH AN UNBEATABLE LOCATION & VIEWS	<b></b><br />The ELEET Property Group proudly presents this four bedroom plus study, fully established spacious residence. Master bedroom has en-suite and walk-in robe. Other bedrooms are standard sized and have built in robes. The spacious kitchen com...	[]	7-benetti-drive-lara-vic-3212-2015835220
31	2015863844	Agency	30068	CONTACT	CONTACT	CONTACT	['AirConditioning', 'BuiltInWardrobes', 'Ensuite', 'Floorboards', 'Heating']	House	2.0	3.0	3	Melbourne Region	ST ALBANS	3021	12 Beaver Street, St Albans	-37.7493668	144.805786	Unlimited Potential In Convenient Location!	"<b></b><br />Your 3-bedroom home with ample space awaits you! Complete with a large living and rumpus zone, a shared kitchen and meals area, and a pergola for entertaining, this St Albans home will sell fast.

Positioned in a great location with walkin..."	[]	12-beaver-street-st-albans-vic-3021-2015863844
