	id	advertiser_type	advertiser_id	price	price_min	price_max	features	property_type	bathrooms	bedrooms	carspaces	region	suburb	postcode	address	latitude	longitude	headline	description	labels	listingSlug
20	2015636712	Agency	11931	$529,000	529000		['AirConditioning', 'Dishwasher', 'Shed', 'SolarPanels']	House	2.0	3.0	4	South Western Victoria	ELLIMINYT	3250	26 Tulloh Street, Elliminyt	-38.366333	143.5898	Mid Century Modern with Magnificent Views	<b></b><br />26 Tulloh Street has been renovated to a high standard to create a modern take on its mid century beginnings. Situated on an elevated block of 1010sqm and boasting impressive views over the township to the north (all the way to Mt Buninyon...	['Under offer']	26-tulloh-street-elliminyt-vic-3250-2015636712
21	2015897663	Agency	13411	$525,000 - $555,000	525000	555000	['Bath', 'Dishwasher', 'Study']	House	2.0	4.0	6	South Western Victoria	MINERS REST	3352	13 Creswick Street, Miners Rest	-37.47714	143.798615	LARGE FAMILY HOME WITH SUBSTANTIAL SHEDDING	<b></b><br />Positioned in the popular suburb of Miners Rest, with easy access to the Western Freeway for Melbourne commuters and just minutes to the Ballarat CBD, is this large family home. The home features four generously sized bedrooms, with the ma...	[]	13-creswick-street-miners-rest-vic-3352-2015897663
22	2015902481	Agency	12645	$525,000	525000		['BuiltInWardrobes', 'Ensuite', 'SecureParking', 'Heating', 'Shed']	House	2.0	5.0	8	South Eastern Victoria	FOSTER	3960	45 FULLERS ROAD, Foster	-38.66627	146.211929	TWO HOMES, 1 ACRE - MINUTES FROM TOWN	"<b></b><br />So much on offer with two residences set on approx 1 acre of flat usuable land. Ideal to live in one and rent the other, for extended family or to run a business from home (STCA).
Main family residence with covered entertaining deck, blac..."	[]	45-fullers-road-foster-vic-3960-2015902481
23	2014489420	Agency	27527	CONTACT	CONTACT	CONTACT	['BuiltInWardrobes', 'SecureParking', 'Heating']	House	2.0	3.0	4	Melbourne Region	WERRIBEE	3030	166 Tarneit Road, Werribee	-37.885746	144.662338	TREASURE IN A PERFECT LOCATION !!	"<b></b><br />If you have been searching for the perfect mix of a well finished home, on an incredible block, in an outstanding location then look no further, because this brick stunner provides the full trifecta! Offering;

- 3 good sized bedrooms (m..."	[]	166-tarneit-road-werribee-vic-3030-2014489420
24	2015916131	Agency	11863	$535,000-$560,000	535000	560000	['AirConditioning', 'BuiltInWardrobes', 'Ensuite', 'Floorboards', 'Gas', 'Heating', 'Dishwasher']	House	3.0	6.0	4	Northern Victoria	BENDIGO	3550	111 Sternberg Street, Bendigo	-36.7687874	144.29245	CHARM-FILLED CALIFORNIA BUNGALOW WITH SELF-CONTAINED UNIT	<b></b><br />111 Sternberg St has much on offer and a couple of surprises too.  Firstly, this lovely 1930's home has retained much of its character and charm; secondly there is a large extension adding a second living space, bathroom and laundry and th...	[]	111-sternberg-street-bendigo-vic-3550-2015916131
25	2015681375	Agency	8650	Edge Of Town Living $520,000	520000		['AirConditioning', 'BuiltInWardrobes', 'Gas', 'SecureParking', 'AlarmSystem', 'Heating', 'Dishwasher']	House	2.0	4.0	4	Northern Victoria	KYABRAM	3620	2 Jenmar Drive, Kyabram	-36.32955	145.043808	2 Jenmar Drive, Kyabram	"<b></b><br />This modern 24sq Brick Veneer home, located in a popular subdivision of the edge on town, has never been lived in
The floor plan features open living with stunning kitchen plus an additional living area with 2nd kitchen, 4 bedrooms, 2 bat..."	[]	2-jenmar-drive-kyabram-vic-3620-2015681375
26	2015871426	Agency	20379	AUCTION	AUCTION	AUCTION	['AirConditioning', 'BuiltInWardrobes', 'Ensuite', 'Gas', 'SecureParking', 'Heating', 'Study', 'Shed']	House	2.0	3.0	4	Melbourne Region	HOPPERS CROSSING	3029	23 Grevillea Crescent, Hoppers Crossing	-37.8629875	144.718536	Beautifully renovated family home on 696m2 approx.	"<b></b><br />Situated in a prime and sought after location, 23 Grevillea Crescent stands proudly in the Bellbridge Estate of Hoppers Crossing. 

This beautifully renovated and immaculately presented family home boast its young, contemporary and high ..."	['Under offer']	23-grevillea-crescent-hoppers-crossing-vic-3029-2015871426
27	2015916304	Agency	19275	$520,000	520000		['BuiltInWardrobes', 'Gas', 'SecureParking', 'Heating', 'Study']	House	2.0	4.0	4	South Eastern Victoria	WARRAGUL	3820	12 Brentwood Court, Warragul	-38.159153	145.943344	Large & Lovable with Loads of Soul	<b></b><br />When looking for your dream home, you'll want soul and character within a house and 12 Brentwood Court, Warragul provides just that and more. Large and lovable, this spacious but cosy family home tucked away in its own private pocket provi...	[]	12-brentwood-court-warragul-vic-3820-2015916304
28	2015122165	Agency	15886	$520,000	520000		['Study']	House	2.0	4.0	5	South Eastern Victoria	DROUIN	3818	10 Lampard Road, Drouin	-38.1378059	145.854111	Developers Dream	<b></b><br />Situated in one of Drouins most sort after position within walking distance to train station, shops schools and Kindergartens is the unique opportunity to secure this home on a generous 1500sqm allotment with current development approval t...	[]	10-lampard-road-drouin-vic-3818-2015122165
29	2015838373	Agency	17493	$520,000 - $540,000	520000	540000	['AirConditioning', 'BuiltInWardrobes', 'Gas', 'SecureParking', 'Bath', 'Heating', 'Dishwasher', 'FullyFenced']	House	2.0	3.0	4	Northern Victoria	CASTLEMAINE	3450	3 Ely Court, Castlemaine	-37.0676765	144.1954	Charming Brick Gem	<b></b><br />Welcome to this bright, happy home, nestled in the heart of Ely Court. From the front to the back there is plenty to see and something for everyone to enjoy, starting with the garden  a large ornamental pear tree in the front yard, lots of...	[]	3-ely-court-castlemaine-vic-3450-2015838373
30	2015889566	Agency	13042	$519,990	519990		['Ensuite', 'SecureParking']	House	2.0	3.0	4	South Western Victoria	CRESWICK	3363	Creswick	-37.42412	143.891235	Your Country Dream Awaits!	"<b></b><br />We are pleased to present this spacious 3 bedroom family home which is situated in a quiet and tucked away pocket of Creswick, not too far from the growing selection of wonderful cafes, pubs and shops in the main street.
The home itself o..."	[]	creswick-vic-3363-2015889566
31	2015793342	Agency	3227	$519,000	519000		['Ensuite', 'Heating', 'Shed']	House	2.0	4.0	6	South Eastern Victoria	COWWARR	3857	15 Thompson Drive, Cowwarr	-38.0001564	146.653183	EXCEPTIONAL COUNTRY LIVING!	"<b></b><br />Beautifully presented & as new throughout American Barn style home positioned on 4 acres just opposite Cowwarr Weir. A terrific family home for everyone to enjoy. 
Features Include;

- 4 bedrooms all with built in robes, ensuite to main..."	[]	15-thompson-drive-cowwarr-vic-3857-2015793342
32	2014776690	Agency	8176	$519,000	519000		['AirConditioning', 'BuiltInWardrobes', 'Ensuite', 'SecureParking', 'Dishwasher']	House	2.0	4.0	4	Melbourne Region	BANNOCKBURN	3331	14 Cabernet Court, Bannockburn	-38.0409126	144.163437	Family home in a fantastic location - 640m2	"<b></b><br />This well-presented four bedroom family home is situated in a prime location allowing families walking access to the new school, sporting complex, walking track, parks and the township of Bannockburn. 
The home features a formal living ro..."	[]	14-cabernet-court-bannockburn-vic-3331-2014776690
33	2015649810	Agency	17899	CONTACT	CONTACT	CONTACT	['Ensuite', 'Gas', 'SecureParking', 'Dishwasher', 'Shed']	House	2.0	4.0	4	South Western Victoria	MINERS REST	3352	8 Barley Sheaf Drive, Miners Rest	-37.5014076	143.8037	Perfect Home For The Growing Family Or The Entertainer	"<b></b><br />If you have a large family, and love to entertain, look no further than this impressive home in sought after Miners Rest. With the added feature of a 2-car garage with and bonus area for the workshop or man cave. 

The home itself featur..."	['Under offer']	8-barley-sheaf-drive-miners-rest-vic-3352-2015649810
34	2015833098	Agency	12758	$540,000 - $570,000	540000	570000	['SecureParking', 'IndoorSpa', 'Heating', 'Shed', 'FullyFenced']	House	2.0	5.0	6	Northern Victoria	HUNTLY	3551	170 Gray Road, Huntly	-36.65317	144.286713	Unique Dual-occupancy Home in Semi-rural Huntly	<b></b><br />Gloriously positioned on 29.8 acres, only 20 minutes from Bendigo CBD, this lifestyle property has it all. The uniquely designed, dual occupancy home shares a spacious four bedroom family home with a one bedroom granny flat, teenage retrea...	[]	170-gray-road-huntly-vic-3551-2015833098
35	2015927169	Agency	7279	$510,000 to $540,000	510000	540000	['Ensuite', 'Gas', 'Heating', 'Shed', 'FullyFenced']	House	2.0	3.0	4	Melbourne Region	KINGLAKE	3763	10 Robertson Road, Kinglake	-37.5314178	145.342728	WITH ENDLESS POSSIBILITIES - GET IN THE MARKET	<b></b><br />A gorgeous home in an idyllic location, this updated weather board home is nestled on a 1350m2 block set in a beautiful leafy surround with stunning old world trees and only moments from the centre of town is a great opportunity for the fi...	[]	10-robertson-road-kinglake-vic-3763-2015927169
36	2015701315	Agency	29720	$510,000 - $560,000	510000	560000	['Gas', 'SecureParking', 'Heating', 'Dishwasher', 'Shed', 'FullyFenced']	House	2.0	4.0	3	Melbourne Region	ROSEBUD	3939	40 Elwers Road, Rosebud	-38.3590775	144.918121	Walk to Everything!	"<b></b><br />Situated in beachside Rosebud, sits this four-bedroom, two-bathroom family home. Resting on 604m2 (approx.) of flat land, offering convenient living with the Rosebud Foreshore & McCrae Plaza, only moments away.

Entering the home, you ar..."	[]	40-elwers-road-rosebud-vic-3939-2015701315
37	2015483999	Agency	23999	CONTACT	CONTACT	CONTACT	['Floorboards', 'Gas', 'InternalLaundry', 'Heating', 'GardenCourtyard']	House	2.0	4.0	4	Melbourne Region	WYNDHAM VALE	3024	30 Stream Road, Wyndham Vale	-37.868187	144.613022	Stunning and brand new spacious family home!	"<b></b><br />Make your way into Wyndham Vale's fastest growth area.

Located near Manor Lakes, this family home has just been recently completed and ready for you immediately.

Comprising of 4 sizable bedrooms with built in robes. 
Master bedroom with ..."	[]	30-stream-road-wyndham-vale-vic-3024-2015483999
38	2015860230	Agency	8645	$510,000 - $535,000	510000	535000	['Study']	House	2.0	3.0	4	Melbourne Region	BACCHUS MARSH	3340	8 Leila Court, Bacchus Marsh	-37.66534	144.4408	SOLD!-  HAPPY VENDOR =  HAPPY PURCHASER= HAPPY AGENT	"<b></b><br />Showcasing the quality and craftsmanship of this well built home on a generous 1294 sqm parcel of land, this family residence offers a highly functional floorplan designed with relaxed living in mind.
And with extras such as north/east fa..."	[]	8-leila-court-bacchus-marsh-vic-3340-2015860230
39	2015396407	Agency	17238	$505,000-$520,000	505000	520000	['AirConditioning', 'BuiltInWardrobes', 'CableOrSatellite', 'Ensuite', 'Gas', 'InternalLaundry', 'PetsAllowed', 'SecureParking', 'NorthFacing', 'Bath', 'Heating', 'Dishwasher', 'Study', 'FullyFenced', 'SolarHotWater', 'SolarPanels']	House	2.0	3.0	4	Northern Victoria	YARRAWONGA	3730	28 Coco Crescent, Yarrawonga	-36.0094261	146.03688	Great views of Golf Course- Silverwoods	"<b></b><br />Phone Enquiry ID: 80234

Golf view designed home on 2 levels.
Three bedrooms BIR's, two bathrooms plus study.
Master has large walk-in robe and ensuite
Stylish kitchen with stainless steel appliances & walk-in pantry.
Large open plan..."	[]	28-coco-crescent-yarrawonga-vic-3730-2015396407
40	2015328658	Agency	17493	$525,000	525000		['BuiltInWardrobes', 'Ensuite', 'Gas', 'SecureParking', 'Heating', 'Dishwasher', 'FullyFenced']	House	2.0	4.0	4	Northern Victoria	MCKENZIE HILL	3451	9 Phyllis Crescent, Mckenzie Hill	-37.06714	144.191071	A Perfect Choice	<b></b><br />A balance of quality styling, low maintenance design and functional spaces reflect the care that has gone into creating this easy living, contemporary home only minutes from the centre of Castlemaine. Greeted by light filled living spaces ...	[]	9-phyllis-crescent-mckenzie-hill-vic-3451-2015328658
41	2014983214	Agency	23123	$499,000	499000		['Gas', 'Heating', 'Shed', 'SolarHotWater']	House	2.0	4.0	3	Northern Victoria	KILLARA	3691	17 Klim Street, Killara	-36.14012	146.949646	Hard Work Done For You	<b></b><br />Why build when you can have as new and display house quality in this popular family estate? This quality build and design incorporates spacious living, modern colouring with very functional upgrades, low maintenance 706 m2 yard and only 5 ...	[]	17-klim-street-killara-vic-3691-2014983214
42	2015835123	Agency	29834	NA	NA	NA	['AirConditioning', 'BuiltInWardrobes', 'Ensuite', 'Floorboards', 'SecureParking', 'SwimmingPool', 'Heating', 'Dishwasher', 'Study', 'Shed']	House	2.0	4.0	4	Melbourne Region	HARKNESS	3337	42 Gamalite Drive, Harkness	-37.6677933	144.563782	Resort style living adjacent to Navan Park Lake!!!	<b></b><br />Awesome family home displaying designer flair, exhibiting warmth and finesse in the peaceful precinct. This generous and versatile dimensions effortlessly cater to every stage of family life. Boasting wide frontage on a large allotment and...	['Under offer']	42-gamalite-drive-harkness-vic-3337-2015835123
43	2015913342	Agency	11897	AUCTION	AUCTION	AUCTION	['SecureParking']	House	2.0	4.0	4	Melbourne Region	DALLAS	3047	4 Donald Street, Dallas	-37.672596	144.9424	Roll Up Your Sleeves!	<b></b><br />Perfectly positioned in the heart of popular Dallas, this solid residence blends both space and location. There is an original three-bedroom home at the front, attached to a self-contained one-bedroom studio which could be rented separatel...	[]	4-donald-street-dallas-vic-3047-2015913342
44	2015647942	Agency	23542	$500,000 - $530,000	500000	530000	['Ensuite', 'SecureParking', 'Bath', 'FullyFenced', 'RainwaterStorageTank']	House	2.0	4.0	3	Melbourne Region	CORONET BAY	3984	41 Champ Elysees Esplanade, Coronet Bay	-38.4367027	145.435913	RELAXED AND PRIVATE BEACH HOME ON CHAMP ELYSEES ESPLANADE	"<b></b><br />Offering a sought-after coastal lifestyle, this family home boasts a bright open plan design with 4 bedrooms and low maintenance garden, outdoor entertaining in a private surround walking distance to the beach, approx. 90 meters.
The Home ..."	[]	41-champ-elysees-esplanade-coronet-bay-vic-3984-2015647942
45	2015518259	Agency	5005	$500,000 - $550,000	500000	550000	['AirConditioning', 'BuiltInWardrobes', 'Ensuite', 'Gas', 'Intercom', 'Heating', 'Dishwasher', 'Shed', 'SolarPanels']	House	2.0	4.0	3	Melbourne Region	GROVEDALE	3216	8 Chiller Court, Grovedale	-38.21315	144.3193	Malishev built, large family home.	<b></b><br />If a large family home in a court location is what you're looking for, don't go past this quality, Malishev built home. Comprising 4 bedrooms, ensuite and walk-in robe to master and built in robes to remaining generous sized bedrooms. Enor...	[]	8-chiller-court-grovedale-vic-3216-2015518259
46	2015523291	Agency	20054	$480,000 - $520,000	480000	520000	['AirConditioning', 'BuiltInWardrobes', 'Ensuite', 'SecureParking', 'Heating']	House	2.0	3.0	3	Melbourne Region	POINT COOK	3030	58E Tom Roberts Parade, Point Cook	-37.8930435	144.727	Best First Home or Smart Investment in the TOP Location!	"<b></b><br />CALL ALL First Home Buyers or Smart Investors!

Immaculately presented family home is set on a good size allotment of 320m2 (approx.). Perfectly located in the enviable estate of Innisfail, built with quality modern features and contempo..."	['Auction Sat 14 Dec']	58e-tom-roberts-parade-point-cook-vic-3030-2015523291
47	2015316206	Agency	24072	$499,000	499000		['AirConditioning', 'Ensuite', 'Gas', 'PetsAllowed', 'SecureParking', 'SwimmingPool', 'Heating', 'Dishwasher', 'Study', 'Shed', 'FullyFenced']	House	2.0	4.0	4	Northern Victoria	KIALLA	3631	4 Plover Drive, Kialla	-36.42389	145.383377	Seven Creeks Estate...Plover Drv, Huge block !	"<b></b><br />This large family home is in arguably one of Goulburn Valley's most sought after areas, Sevens Creek Estate!

The home consists of four bedrooms plus study, two living areas and this outstanding package sits on a large residential block ..."	[]	4-plover-drive-kialla-vic-3631-2015316206
48	2015892791	Agency	28523	$500,000 - $550,000	500000	550000	['Ensuite', 'SecureParking', 'Heating']	House	2.0	4.0	4	Melbourne Region	ST ALBANS	3021	15 Larisa Road, St Albans	-37.750145	144.81926	A Position that Favours Family	<b></b><br />Completely charming, this homes clean and bright spaces offer unexpectedly spacious living immediately opposite Larisa Reserves open spaces and sporting facilities. Framed by neatly manicured gardens are delightful open plan interiors enco...	['Auction Sat 14 Dec']	15-larisa-road-st-albans-vic-3021-2015892791
49	2015814664	Agency	8627	$480,000 - $520,000	480000	520000	['AirConditioning', 'BuiltInWardrobes', 'Ensuite', 'Gas', 'SecureParking', 'Heating', 'Dishwasher', 'Shed', 'FullyFenced']	House	2.0	4.0	3	Northern Victoria	KIALLA	3631	10 Kerang Avenue, Kialla	-36.42342	145.402725	Low Maintenance, Relaxing and Superior Living...	<b></b><br />This beautiful four-bedroom executive home is ideally positioned between Lake Amaroo & Lake Lowana and provides so much more than its tranquil location. Built only seven years ago, this home is immaculate inside & out and presents as a Dis...	['Under offer']	10-kerang-avenue-kialla-vic-3631-2015814664
50	2015902091	Agency	4596	$490,000 - $530,000	490000	530000	['AirConditioning', 'BuiltInWardrobes', 'Ensuite', 'Gas', 'Heating', 'Dishwasher', 'Study', 'Shed']	House	2.0	4.0	3	Northern Victoria	STRATHDALE	3550	118 Crook Street, Strathdale	-36.76393	144.313889	PERFECT PARKSIDE POSITION	<b></b><br />Perfectly positioned park-side home is set on an easy-care approx 762sqm block. The versatile floor plan features four bedrooms and a study, two bathrooms, two living zones, contemporary kitchen and serene outdoor spaces. Updated in all th...	['Under offer']	118-crook-street-strathdale-vic-3550-2015902091
51	2015896159	Agency	15886	$500,000-$550,000 + GST	500000	550000	['Shed']	House	2.0	10.0	6	South Eastern Victoria	WARRAGUL	3820	9 McDonald Street, Warragul	-38.16082	145.918839	The Sky Is The Limit!	<b></b><br />In almost every town there resides a building famously known and entrenched within the town's heritage. Rarely however, does such an icon like this become available for sale. Once the home of a Railway Depot, then the home of West Gippslan...	[]	9-mcdonald-street-warragul-vic-3820-2015896159
52	2015927803	Agency	20366	CONTACT	CONTACT	CONTACT	['AirConditioning', 'Ensuite', 'Gas', 'SecureParking', 'Heating', 'Dishwasher', 'Study', 'Shed']	House	2.0	4.0	4	Melbourne Region	ST ALBANS PARK	3219	62-64 Homestead Drive, St Albans Park	-38.1906	144.393585	Genuine Family Home with Space for Everyones Toys	"<b></b><br />Completely refreshed right throughout from top to bottom, this solidly built home offers an expansive and flexible floor plan for families to comfortably call home sweet home.

Positioned on a wide allotment of approx. 730m2, the home le..."	[]	62-64-homestead-drive-st-albans-park-vic-3219-2015927803
53	2015518708	Agency	11919	CONTACT	CONTACT	CONTACT	['AirConditioning', 'BuiltInWardrobes', 'CableOrSatellite', 'SecureParking', 'SwimmingPool', 'Gym', 'AlarmSystem', 'BroadbandInternetAccess', 'Bath', 'Heating', 'Study', 'Shed', 'FullyFenced', 'SolarPanels']	House	2.0	4.0	5	Melbourne Region	TARNEIT	3029	Tarneit	-37.809166	144.6672	Exceptional Opportunity	"<b></b><br />Jazz Real Estate proudly presents this amazing family home set of approx 577sqm land. 
Discover a light-filled, open-plan living and dining area revolving around a sparkling kitchen showcasing high-quality, stainless-steel appliances and ..."	[]	tarneit-vic-3029-2015518708
54	2015909830	Agency	4596	$495,000 - $525,000	495000	525000	['AirConditioning', 'Ensuite', 'SwimmingPool', 'Shed']	House	2.0	3.0	6	Northern Victoria	JUNORTOUN	3551	166 Bennetts Road, Junortoun	-36.7855339	144.399979	SPACIOUS FAMILY SANCTUARY	"<b></b><br />A Charming mudbrick family home nestled amongst the trees  this five acre property is your ultimate quiet retreat. 

Imagine coming home of a night to the tranquil sounds of nature or waking up to views of your dam and spacious backyard ..."	[]	166-bennetts-road-junortoun-vic-3551-2015909830
55	2015658213	Agency	15013	$499,500	499500		['SecureParking', 'SwimmingPool', 'Study', 'SolarPanels']	House	2.0	5.0	3	South Eastern Victoria	HEYFIELD	3858	7 Mary Street, Heyfield	-37.9782372	146.785889	Fantastic Family Home	"<b></b><br />* Land Size Approx 1619sqm (Double Block) House Size Approx 30sq
* Located Adjacent To Park Lands & Short Walk To Shops & Schools
* 5 Large Bedrooms Plus Study
* Large Kitchen With Island Bench
* Open-Plan Dining/Living With Rumpus Roo..."	[]	7-mary-street-heyfield-vic-3858-2015658213
56	2015668312	Agency	4714	$499,000	499000		['AirConditioning', 'Ensuite', 'SecureParking', 'Heating']	House	2.0	3.0	4	Melbourne Region	COWES	3922	35A Plover  Street, Cowes	-38.4586067	145.211716	Stop looking,this is THE one!	"<b></b><br />The perfect getaway or home awaits with this fantastic renovated home with all the hard work done there is nothing to do but move in and enjoy.

Featuring 3 good sized bedrooms,2 modern bathrooms the master with en-suite,brand new kitche..."	[]	35a-plover-street-cowes-vic-3922-2015668312
57	2015764922	Agency	16913	$499,950 - $520,000	499950	520000	['Ensuite', 'Gas', 'SecureParking', 'Bath', 'Heating', 'Shed']	House	2.0	4.0	3	South Western Victoria	BALLARAT EAST	3350	6 Henfield Close, Ballarat East	-37.57062	143.89476	Sensational Allotment, A Great Package In A Top Position	"<b></b><br />Amazing package, 1006sqm (Approx) with shedding and lots of room for your caravan, trailer and other vehicles
Four king size bedrooms. The master has walk in robes and a double vanity ensuite
Three living areas that offer room to move an..."	['Under offer']	6-henfield-close-ballarat-east-vic-3350-2015764922
58	2015526984	Agency	24072	$499,000 - $530,000	499000	530000	['AirConditioning', 'Ensuite', 'PetsAllowed', 'SwimmingPool', 'Dishwasher', 'Shed', 'FullyFenced', 'SolarPanels']	House	2.0	3.0	3	Northern Victoria	TOOLAMBA	3614	34 Wren Street, Toolamba	-36.4899673	145.33989	Unique home in a quality town...	"<b></b><br />The original owners have called time on this unique property and if it's quality you demand then look no further. 

Built in the 1990's and set on a 2000sqm residential block with town water is this lovely two storey home. With three bed..."	[]	34-wren-street-toolamba-vic-3614-2015526984
59	2015632026	Agency	26858	$499,000 - $548,000	499000	548000	['SecureParking', 'Heating', 'Dishwasher']	House	2.0	4.0	4	Melbourne Region	ARMSTRONG CREEK	3217	27 Vaughan Drive, Armstrong Creek	-38.2306175	144.361771	Beautifully Designed Brand-New Home for Family Living	"<b></b><br />Every element of this impressive brand-new Glenville home is pure perfection; from its striking facade through to contemporary décor & design, especially tailored to accommodate growing families.

The modern aesthetics and high-end finis..."	[]	27-vaughan-drive-armstrong-creek-vic-3217-2015632026
60	2014594714	Agency	6756	$499,000 - $525,000	499000	525000	['AirConditioning', 'BuiltInWardrobes', 'Ensuite', 'SecureParking', 'AlarmSystem', 'Bath', 'Study']	House	2.0	4.0	3	Northern Victoria	SHEPPARTON	3630	21 Dunstan Court, Shepparton	-36.35828	145.409439	Outstanding Elegance	<b></b><br />From the moment you walk in the door you are greeted with style and a flood of natural light.  This 4-bedroom home with two living areas is nestled in a quiet area within walking distance to the hospitals and close to sporting facilities, ...	[]	21-dunstan-court-shepparton-vic-3630-2014594714
61	2014276721	Agency	28360	$499,500 to $529,000	499500	529000	['Ensuite', 'Heating', 'Dishwasher', 'Shed']	House	2.0	4.0	6	South Western Victoria	MOYSTON	3377	220 Wilde Lane, Moyston	-37.3224869	142.750488	LIFESTYLE PROPERTY WITH GRAMPIANS VIEWS	<b></b><br />With magnificent views of the Grampians this unique lifestyle property is sure to get your attention, an executive home on 20 fabulous acres for the family to create many memories for years to come. The moment you enter this substantial ho...	[]	220-wilde-lane-moyston-vic-3377-2014276721
62	2012927192	Agency	17238	$495,000 - $499,000	495000	499000	['AirConditioning', 'BuiltInWardrobes', 'Ensuite', 'Gas', 'PetsAllowed', 'SecureParking', 'AlarmSystem', 'Bath', 'Heating', 'Dishwasher', 'FullyFenced', 'RainwaterStorageTank', 'SolarPanels']	House	3.0	3.0	6	South Eastern Victoria	THE HONEYSUCKLES	3851	19 Mandalay Drive, The Honeysuckles	-38.34968	147.222626	Ever wanted to live directly on a lake and next to the ocean?	"<b></b><br />Phone Enquiry ID: 11194

This near new, pristine condition, home offers the very best in comfort and lifestyle.
With a lake as your back fence and the ocean moments from your front, all you need is a house with everything to have everyt..."	[]	19-mandalay-drive-the-honeysuckles-vic-3851-2012927192
63	2015914063	Agency	26896	$495,000 - $535,000	495000	535000	['BuiltInWardrobes', 'Ensuite', 'Floorboards', 'Gas', 'Bath', 'Heating', 'Dishwasher', 'Shed']	House	2.0	4.0	6	South Western Victoria	LUCAS	3350	28 Messenger Parade, Lucas	-37.5478325	143.773087	Stunning Four Bedroom Family Home with Excellent Shedding	<b></b><br />This stunning home is meticulous in presentation from front to back, inside and out. Beautifully presented is this two-year old JG King four bedroom, two living corner allotment home overlooking wetlands and beautiful walking tracks, on a ...	[]	28-messenger-parade-lucas-vic-3350-2015914063
