	id	advertiser_type	advertiser_id	price	price_min	price_max	features	property_type	bathrooms	bedrooms	carspaces	region	suburb	postcode	address	latitude	longitude	headline	description	labels	listingSlug
52	2015209408	Agency	15005	$565,000	565000		['AirConditioning', 'BuiltInWardrobes', 'Ensuite', 'Gas', 'NorthFacing', 'Dishwasher', 'Study', 'SolarPanels']	House	3.0	4.0	7	South Eastern Victoria	WURRUK	3850	37 RIVERVIEW Road, Wurruk	-38.10725	147.040436	"A ""PARK LIKE"" SETTING! AN AMAZING HOME! AND UNSURPASSED VIEWS!"	<b></b><br />Walk onto this ¾ acre property and you will be amazed immediately. The setting is one of the nicest that we have seen with undulating established grounds and uninterrupted rural views. The design of the home allows every room to enjoy what...	[]	37-riverview-road-wurruk-vic-3850-2015209408
53	2015912316	Agency	16028	$565,000	565000		['BuiltInWardrobes', 'Ensuite', 'Gas', 'SecureParking', 'SwimmingPool', 'Heating', 'Dishwasher', 'FullyFenced', 'SolarPanels']	House	2.0	4.0	3	Northern Victoria	YARRAWONGA	3730	12 Mary Court, Yarrawonga	-36.00717	146.019882	Peacefully Positioned	"<b></b><br />Peacefully Positioned in a quiet court just moments from Lake Mulwala in a well-established area, this beautiful 4 bedroom home has a lot to offer a growing family, or first home buyer.

With large windows allowing for natural light, 10f..."	[]	12-mary-court-yarrawonga-vic-3730-2015912316
54	2015232239	Agency	19370	$561,300	561300		['SecureParking', 'Study']	House	2.0	4.0	3	Melbourne Region	KALKALLO	3064	Kalkallo	-37.5245628	144.955673	NEW MODERN STYLE	"<b></b><br />2 Part contract

Alfresco, 2 Living areas and Study

Ground Living:	140 m²
Outdoor Living:	8  m²
Garage Area:	37 m²
Porch Area:           5 m²
House Size:	       191 m²"	[]	kalkallo-vic-3064-2015232239
55	2015732682	Agency	15801	$560,000	560000		['AirConditioning', 'BuiltInWardrobes', 'SecureParking', 'Furnished', 'Dishwasher', 'Shed', 'FullyFenced']	House	2.0	4.0	4	South Eastern Victoria	MALLACOOTA	3892	66 Mirrabooka Road, Mallacoota	-37.5483131	149.75058	Fully Furnished Holiday Home with Future Bookings	"<b></b><br />We are pleased to offer this immaculate property - Coota Time!

Fabulous 2 storey, 4 bedroom, 2 bathroom home located a scenic 15 min walk along the lakeside boardwalk to the town centre or 2 min drive by car. The home has a large deck t..."	[]	66-mirrabooka-road-mallacoota-vic-3892-2015732682
56	2014998261	Agency	4805	$560,000	560000		['AirConditioning', 'BuiltInWardrobes', 'Ensuite', 'Gas', 'SwimmingPool', 'Study', 'Shed', 'SolarPanels']	House	2.0	3.0	4	Northern Victoria	BOOSEY	3730	12 Dead River Track, Boosey	-35.99283	145.796173	FEEL THE SERENITY !!!	"<b></b><br />Abutting state forest this magical rural property is situated approximately one kilometre from the mighty Murray River with picturesque views to a Murray River anabranch.
This particularly well presented residence is set on 9,446 sq mtr (..."	[]	12-dead-river-track-boosey-vic-3730-2014998261
57	2015653747	Agency	26139	$560,000	560000		['Ensuite', 'SecureParking', 'Dishwasher', 'Shed', 'FullyFenced', 'SolarHotWater']	House	2.0	4.0	5	South Eastern Victoria	PAYNESVILLE	3880	20 Riviera Close, Paynesville	-37.90874	147.713379	A CUT ABOVE THE REST	<b></b><br />Set on large 1,244m2 allotment this quality master built home delivers a pleasing floor plan.  Formal lounge area at the front of the home with bar nook, well equipped kitchen which provides plenty of bench and storage space with quality a...	[]	20-riviera-close-paynesville-vic-3880-2015653747
58	2015518048	Agency	8259	$560,000	560000		['BuiltInWardrobes', 'Ensuite', 'Gas', 'SecureParking', 'GroundFloor', 'WaterViews', 'Heating', 'SolarHotWater']	House	3.0	4.0	3	South Eastern Victoria	EAGLE POINT	3878	2 The Crescent, Eagle Point	-37.9018135	147.712158	WHAT A HOUSE!	<b></b><br />Look no further, we are selling a double storey quality home on 639sqm of land with lovely views to Lake King. This home is perfect for the buyer wanting low maintenance care or prefers to lock up and travel with ease. Ground floor: Living...	[]	2-the-crescent-eagle-point-vic-3878-2015518048
59	2015886015	Agency	20540	CONTACT	CONTACT	CONTACT	['BuiltInWardrobes', 'Ensuite', 'SecureParking', 'Heating', 'Dishwasher', 'Shed']	House	2.0	4.0	4	Melbourne Region	KINGLAKE	3763	16 Kinglake-Glenburn Road, Kinglake	-37.530407	145.342331	FAMILY HOME IN PRIME POSITION	<b></b><br />Are you looking for a entry level family home close to shops and amenities? Then this property is for you. Perched at the top of the street is this generous brick veneer home on an expansive 3rd of an acre allotment. A modern home with a g...	[]	16-kinglake-glenburn-road-kinglake-vic-3763-2015886015
60	2015420203	Agency	7986	$560,000	560000		['AirConditioning', 'BuiltInWardrobes', 'SecureParking', 'Shed']	House	2.0	3.0	5	South Eastern Victoria	ALBERTON	3971	8659 SOUTH GIPPSLAND HIGHWAY, Alberton	-38.58019	146.671967	FARMLET ON TOWN'S EDGE	<b></b><br />Situated 2kms out from Yarram and all it's amenities, you will find this delightful farmlet located in an excellent position and comprising approximately 13.5 acres. Just next door is the rail trail for your convenience, walk or ride your ...	[]	8659-south-gippsland-highway-alberton-vic-3971-2015420203
61	2015227794	Agency	28775	$560,000 - $616,000	560000	616000	['AirConditioning', 'BuiltInWardrobes', 'Floorboards', 'SecureParking', 'SwimmingPool', 'Heating', 'TennisCourt']	House	2.0	4.0	6	Northern Victoria	CARDROSS	3496	228 Myall Street, Cardross	-34.2985	142.161224	Ultimate Family Home and Lifestyle	<b></b><br />You'll feel welcomed home each day as you take the secluded and long gravelled drive toward your own architecturally designed haven. Located on the edge of Mildura with 5megs water, this is the ideal mix of proximity to services with the b...	[]	228-myall-street-cardross-vic-3496-2015227794
62	2015825596	Agency	8435	$569,000 - $589,000	569000	589000	['BuiltInWardrobes', 'Ensuite', 'SecureParking', 'Heating', 'Dishwasher', 'Study', 'Shed', 'SolarPanels']	House	3.0	5.0	6	Northern Victoria	KYABRAM	3620	14 Kashelmara Drive, Kyabram	-36.32904	145.039856	QUALITY, SPACE & MUCH MORE	"<b></b><br />	Absolute quality family home inside & out. Craftsman built property of 298m2 (32Sq) living area located on spacious 6259m2 block complete with inground sprinklers.
	Features include: 5 bedrooms plus study, ensuite, formal & family living..."	['Under offer']	14-kashelmara-drive-kyabram-vic-3620-2015825596
63	2015865339	Agency	28162	$560,000 - $580,000	560000	580000	['BuiltInWardrobes', 'SecureParking', 'Heating', 'Dishwasher']	House	2.0	4.0	4	Melbourne Region	TARNEIT	3029	14 Power Street, Tarneit	-37.8202477	144.69133	DREAM HOME BY BOUTIQUE !	"<b></b><br />361 Degrees Real Estate is proud to present 14 Power Street, TARNEIT in the popular estate ROTHWELL .

If a serene and peaceful location is important to you then you have found the right home. It is a great FIRST HOME BUY!!!! , SAVE STAM..."	[]	14-power-street-tarneit-vic-3029-2015865339
64	2015490226	Agency	18363	NA	NA	NA	['Ensuite', 'Shed']	House	3.0	4.0	4	Melbourne Region	HOPPERS CROSSING	3029	3 Tucker Court, Hoppers Crossing	-37.86349	144.677917	Receive $500 P/W as a current rental + Plans & Permits Approved for 3 UNITS	"<b></b><br />Appealing to astute investors and first Home buyers alike, this property offers many options and whatever you decide to do with this property you cannot go wrong.
The existing property offers internally 4 comfortable bedrooms with two ens..."	[]	3-tucker-court-hoppers-crossing-vic-3029-2015490226
65	2015502238	Agency	11947	$559,000	559000		['AirConditioning', 'BuiltInWardrobes', 'Gas', 'SecureParking', 'AlarmSystem', 'Heating', 'Dishwasher', 'FullyFenced', 'RainwaterStorageTank', 'GardenCourtyard']	House	2.0	4.0	4	Melbourne Region	ST LEONARDS	3223	1 Halyard Terrace, St Leonards	-38.187355	144.707275	Perfect Townhouse Investment	<b></b><br />Perfect town house! Perfect position ! in the quality Sea Change Estate. Fronting your own private park this immaculate property has been fastidiously maintained by the vendors as a family getaway. Spacious but low maintenance in a beautif...	[]	1-halyard-terrace-st-leonards-vic-3223-2015502238
66	2015908659	Agency	19180	$559,000 - $589,000	559000	589000	['SecureParking', 'Heating', 'DoubleGlazedWindows', 'SolarHotWater']	House	2.0	4.0	3	Melbourne Region	BROOKFIELD	3338	64 Carissa Road, Brookfield	-37.6882172	144.540833	Exquisite Family Style and Lifestyle	<b></b><br />This beautiful modern home has been quality-built by Burbank Homes. A rare gem in todays market, established in the sought-after Brookfield Estate, set on a great size allotment of 590m2 (approx). Offering everything your family has been l...	[]	64-carissa-road-brookfield-vic-3338-2015908659
67	2015630077	Agency	28547	$555,000	555000		['AirConditioning', 'BuiltInWardrobes', 'Ensuite', 'Gas', 'SecureParking', 'Heating', 'Dishwasher', 'Study', 'Shed', 'SolarPanels']	House	2.0	4.0	3	Northern Victoria	ECHUCA	3564	18 Howell Drive, Echuca	-36.147213	144.722488	If You Need Space...Look At This!	<b></b><br />If you are looking for a large modern home, a shed & space to park the caravan or boat, then this property is a must see. There are 4 extra large bedrooms plus a study, including walk in robe and luxurious ensuite to the master suite along...	[]	18-howell-drive-echuca-vic-3564-2015630077
68	2015836409	Agency	28982	$555,000 NEW PRICE!	555000		['Ensuite', 'Gas', 'SecureParking', 'Heating', 'Dishwasher', 'Shed']	House	2.0	4.0	3	Northern Victoria	ECHUCA	3564	40 Wearne Road, Echuca	-36.1450577	144.721985	Style and Size will Surprise!	<b></b><br />The first thing you notice when entering this well built residence, is the elegant features and abundance of natural light. With a practical, well thought out floor plan comprising of a spacious open plan kitchen/dining and lounge area, se...	[]	40-wearne-road-echuca-vic-3564-2015836409
69	2015904004	Agency	11947	$553,000 - $583,000	553000	583000	['BuiltInWardrobes', 'Ensuite', 'NorthFacing', 'Heating', 'Dishwasher', 'SolarPanels', 'BalconyDeck']	House	2.0	3.0	3	Melbourne Region	CLIFTON SPRINGS	3222	41 Mirrabooka Drive, Clifton Springs	-38.1618576	144.55658	SPIC and SPAN FAMILY HOME	<b></b><br />Tastefully renovated and immaculately presented to the market for sale. This lovely property is located centrally to the local primary school, recreational facilities, boat ramp and the local shopping strip in Clifton Springs. The home has...	[]	41-mirrabooka-drive-clifton-springs-vic-3222-2015904004
70	2015271458	Agency	17707	$549,000	549000		['Floorboards', 'SecureParking', 'FullyFenced']	House	2.0	3.0	5	Melbourne Region	COWES	3922	362 Church Street, Cowes	-38.45215	145.209137	Beautiful Beachhouse Bayviews.	<b></b><br />Great  beach-house with bay views from both levels, relax on the expansive north-facing deck , soak up the sun and the views to Flinders and Red Hill. Open plan living with well appointed kitchen opening to the large deck. Three bedrooms o...	[]	362-church-street-cowes-vic-3922-2015271458
71	2015879092	Agency	28547	$550,000	550000		['AirConditioning', 'BuiltInWardrobes', 'Floorboards', 'SecureParking', 'Study', 'Shed']	House	3.0	7.0	9	Northern Victoria	ECHUCA	3564	442 STRATTON ROAD, Echuca	-36.1556473	144.709412	A Unique Investment and Lifestyle Find	"<b></b><br />So close to town is this property you can see the residential homes not far away. Yet you get to enjoy approximately 6.6 acres set back from the road which offers quiet country living with the convenience of a short drive to town.
Explori..."	[]	442-stratton-road-echuca-vic-3564-2015879092
72	2015772327	Agency	20540	$550,000 - $565,000	550000	565000	['BuiltInWardrobes', 'Ensuite', 'SecureParking', 'Heating', 'Shed', 'DoubleGlazedWindows', 'SolarPanels']	House	2.0	3.0	4	Northern Victoria	FLOWERDALE	3717	Flowerdale	-37.31906	145.328873	SUSTAINABLE SHANGRI-LA	<b></b><br />Nestled in the scenic bends of the King Parrot Creek, and overlooking the beauteous hills of Flowerdale, this serene 2 acre offering blends together a well-appointed brick veneer home, with stunning sustainable features, within only 1 hr 2...	[]	flowerdale-vic-3717-2015772327
73	2015879240	Agency	32929	$550,000 - $595,000	550000	595000	['Ensuite', 'Floorboards', 'SecureParking', 'Heating', 'Dishwasher', 'Study', 'DoubleGlazedWindows']	House	2.0	4.0	4	Melbourne Region	LANG LANG	3984	157 McDonalds Track, Lang Lang	-38.2667656	145.563614	As New With a Perfect Location	<b></b><br />This stunning 2-storey, 7 year old home has been immaculately maintained and cared for and is truly move in ready. With 4 bedrooms, 2 bathroom, 2 living areas inside with a big 2 car garage plus additional extra-height 2 car carport this o...	[]	157-mcdonalds-track-lang-lang-vic-3984-2015879240
74	2014704822	Agency	25682	$550,000 - $590,000	550000	590000	['BuiltInWardrobes', 'Ensuite', 'Floorboards', 'SecureParking', 'SwimmingPool', 'Heating', 'Dishwasher', 'Shed', 'FullyFenced', 'SolarPanels']	House	2.0	4.0	4	Northern Victoria	KANGAROO FLAT	3555	85 Kangaroo Gully Road, Kangaroo Flat	-36.8102455	144.251175	Entertainers family home!	<b></b><br />This beautifully renovated family home has everything the growing family needs.  There are polished timber floors throughout the home, refrigerated heating and cooling, plus solid fuel heating.  The master has a  WIR and ensuite, with the ...	[]	85-kangaroo-gully-road-kangaroo-flat-vic-3555-2014704822
75	2015755820	Agency	30731	$550,000 - $600,000	550000	600000	['AirConditioning', 'BuiltInWardrobes', 'Ensuite', 'Gas', 'SecureParking', 'BroadbandInternetAccess', 'Heating', 'Dishwasher', 'Shed', 'BalconyDeck']	House	2.0	4.0	5	Melbourne Region	CRANBOURNE	3977	9 Arnold Street, Cranbourne	-38.1037331	145.29039	HUGE LIVING AREAS - BUILD OUT THE BACK!	"<b></b><br />Presenting a great property in central Cranbourne with separate living areas & development potential (STCA).

With lovely street appeal starting with new front landscaping, rendered facade and fresh roof, as you step inside you are greet..."	[]	9-arnold-street-cranbourne-vic-3977-2015755820
76	2015664328	Agency	31194	$550,000- $605,000	550000	605000	['Ensuite', 'Floorboards']	House	2.0	3.0	3	Melbourne Region	CRANBOURNE	3977	6 Canterbury Street, Cranbourne	-38.1013	145.285416	Pick of the bunch, your search is over	<b></b><br />Here is the one you have been looking for! With potential, position and possibilities, this 3 bedroom home on a large block is the one. Enjoy the knowledge that one day you can potentially develop the site (STCA) whilst enjoying the now th...	[]	6-canterbury-street-cranbourne-vic-3977-2015664328
77	2015935203	Agency	18476	CONTACT	CONTACT	CONTACT	['Ensuite', 'SecureParking', 'Study']	House	2.0	4.0	6	Melbourne Region	ROXBURGH PARK	3064	35 Salween Crescent, Roxburgh Park	-37.616787	144.930435	A Life of Luxury	<b></b><br />Set in the prestigious and highly sought  after pocket of Roxburgh Park in a unique street, this immaculately maintained home is nothing short of outstanding with a versatile and spacious floor, with enough room for any growing family. The...	[]	35-salween-crescent-roxburgh-park-vic-3064-2015935203
78	2015870055	Agency	22388	AUCTION	AUCTION	AUCTION	['BuiltInWardrobes', 'Ensuite', 'Floorboards', 'Gas', 'SecureParking', 'Heating', 'Dishwasher', 'Shed', 'FullyFenced']	House	2.0	3.0	5	Melbourne Region	CRAIGIEBURN	3064	31 Baronial Way, Craigieburn	-37.60085	144.901428	When Quality Matters!!!	<b></b><br />Every so often a property comes along that really raises the bar, this is IT! This home is beautifully designed and immaculately finished. Attention to detail and a high level of inclusions are evident throughout - from the attractive stre...	[]	31-baronial-way-craigieburn-vic-3064-2015870055
79	2012160060	Agency	11521	$550,000	550000		['AirConditioning', 'BuiltInWardrobes', 'Ensuite', 'InternalLaundry', 'SecureParking', 'WaterViews', 'NorthFacing', 'Bath', 'RainwaterStorageTank']	House	3.0	5.0	4	South Eastern Victoria	LOCH SPORT	3851	26 Seagull Drive, Loch Sport	-38.0354042	147.59375	Lake Victoria At The Back Door	"<b></b><br />
This home will cater for a large family, with 3 lounge areas, 5 bedrooms over 2 levels. The property houses 3 bathrooms, sun room, 2 split system and wood fire warm and cool the property. Spacious North facing deck and only meters to the..."	[]	26-seagull-drive-loch-sport-vic-3851-2012160060
80	2015636726	Agency	8505	CONTACT	CONTACT	CONTACT	['BuiltInWardrobes', 'Ensuite', 'Floorboards', 'SolarPanels']	House	3.0	4.0	5	Melbourne Region	DEER PARK	3023	33 Stevenage Crescent, Deer Park	-37.75332	144.7677	Family Home with Self-Contained Bungalow!	<b></b><br />Ideally positioned, this three (3) bedroom brick veneer family home with a one (1) bedroom self-contained bungalow, is the perfect opportunity for first home buyers, dual families living together or as an astute addition to your investment...	[]	33-stevenage-crescent-deer-park-vic-3023-2015636726
81	2015900567	Agency	4690	$550,000 - $590,000	550000	590000	['AirConditioning', 'BuiltInWardrobes', 'Ensuite', 'SecureParking', 'AlarmSystem', 'Heating']	House	2.0	4.0	4	Melbourne Region	ST ALBANS	3021	22 Feldspar Close, St Albans	-37.7569542	144.819717	Adore The Position & Enjoy The Lifestyle	<b></b><br />This delightful solid brick veneer home presents an exciting warm lifestyle in a serene streetscape surrounded by other quality homes. This four bedroom home comprises of a master with WIR and ensuite, all following bedrooms with BIR,  lar...	['Auction Sat 14 Dec']	22-feldspar-close-st-albans-vic-3021-2015900567
82	2015188312	Agency	11947	$540,000-$570,000	540000	570000	['Ensuite', 'Gas', 'SecureParking', 'Furnished', 'Heating']	House	2.0	4.0	4	Melbourne Region	CLIFTON SPRINGS	3222	6 Jackwood Way, Clifton Springs	-38.1568527	144.581024	First Home Buyers Brand New	<b></b><br />Just completed ! This brand new JG King home is ready and waiting for the astute buyer. Located in a quiet pocket of Clifton Springs with a park at your rear doorstep, there is no hustle and bustle or traffic noise here. Perfect for the fi...	[]	6-jackwood-way-clifton-springs-vic-3222-2015188312
83	2015870722	Agency	22614	$549,000	549000		['Gas', 'SecureParking', 'Heating', 'Shed', 'FullyFenced']	House	2.0	4.0	5	Northern Victoria	YARRAWONGA	3730	41 CHANNEL ROAD, Yarrawonga	-36.040535	146.0	OUTSKIRTS LIVING!	"<b></b><br />A perfect opportunity awaits within this lifestyle property located on the outskirts of the township of Yarrawonga, just a five minute drive to the main street and close to all main amenities! 
The home itself has been very well maintaine..."	[]	41-channel-road-yarrawonga-vic-3730-2015870722
84	2014606526	Agency	18363	$549,000	549000		['SecureParking']	House	2.0	4.0	4	Melbourne Region	WYNDHAM VALE	3024	Wyndham Vale	-37.89	144.63	Elegant Lifestyle	"<b></b><br />Brand New beautiful 4 bedroom family home, featuring a master bedroom with walk in robe and full en-suite, 3 further bedrooms with built in robes, and a family bathroom with separate toilet.
Don't miss this amazing opportunity to live in ..."	[]	wyndham-vale-vic-3024-2014606526
85	2015768121	Agency	12708	CONTACT	CONTACT	CONTACT	['AirConditioning', 'BuiltInWardrobes', 'Ensuite', 'SecureParking', 'Heating', 'Dishwasher']	House	2.0	3.0	4	Melbourne Region	ROXBURGH PARK	3064	2 Magra Place, Roxburgh Park	-37.6323357	144.927231	LOCATION AND LOCATION	<b></b><br />Exclusively situated in a sought after pocket, this refined double story residence's impressive proportions and location creates a haven, designed for comfort, space and enjoyment in a family friendly area. Filled with natural light and lo...	[]	2-magra-place-roxburgh-park-vic-3064-2015768121
86	2015837545	Agency	28547	$550,000	550000		['AirConditioning', 'BuiltInWardrobes', 'Ensuite', 'Floorboards', 'Gas', 'SecureParking', 'SwimmingPool', 'Heating', 'Dishwasher', 'Study']	House	2.0	3.0	4	Northern Victoria	ECHUCA	3564	28 Eyre Street, Echuca	-36.1332321	144.762009	Open Plan Modern Living & Large Shed	"<b></b><br />This home is a total modern rebuild set on a 696sqm corner allotment with easy access to a huge concreted 7m x 13m garage with a 2.7m clearance, remote door & power.  The house retains so much character and lots of ""wow"" factor.  The 3 lar..."	['Under offer']	28-eyre-street-echuca-vic-3564-2015837545
87	2015893016	Agency	7555	$550,000	550000		['Ensuite', 'SecureParking', 'AlarmSystem', 'Bath', 'Shed', 'SolarHotWater']	House	3.0	5.0	4	South Eastern Victoria	METUNG	3904	9 Normans Road, Metung	-37.8581734	147.821	Lake King Views at Metung	"<b></b><br />Presenting an immaculate 9 year old brick veneer home on a generous 2200 sqm block, just a short stroll from the Tambo Bay foreshore..
Consisting of 3 bedrooms, with ensuite and walk in robe to the master suite.  Formal and informal livin..."	[]	9-normans-road-metung-vic-3904-2015893016
88	2015912470	Agency	33183	$550,000 - $595,000	550000	595000	['Ensuite', 'Gas', 'SecureParking', 'Heating', 'Dishwasher', 'Shed']	House	2.0	4.0	4	Northern Victoria	JUNORTOUN	3551	3 Stirling Avenue, Junortoun	-36.77765	144.3424	Room for the family and all the toys!	"<b></b><br />Situated in the prestigious subdivision of McIvor Forest sits this immaculately presented family home.

As you step inside the front door, you'll be impressed with the expanses of space that this home has to offer. Master bedroom to the ..."	[]	3-stirling-avenue-junortoun-vic-3551-2015912470
89	2014875428	Agency	27481	CONTACT	CONTACT	CONTACT	['BuiltInWardrobes', 'Ensuite', 'SecureParking', 'Heating', 'Dishwasher', 'Study']	House	2.0	4.0	3	Melbourne Region	MANOR LAKES	3024	21 Balcombe Drive, Manor Lakes	-37.87459	144.59938	Live by the Lakeside!!!	"<b></b><br />Sensationally set over 2 levels of luxury, this Brand New 4-bedroom family home showcases a tantalising sense of depth and indoor/outdoor space. 

Perfectly positioned overlooking the beautiful lake, the open space parklands and walking ..."	[]	21-balcombe-drive-manor-lakes-vic-3024-2014875428
90	2014909823	Agency	11965	$550,000	550000		[]	House	2.0	4.0	12	South Eastern Victoria	LAKES ENTRANCE	3909	40-42 Roadknight Street, Lakes Entrance	-37.876358	147.998856	Double Bubble Smack Bang in Town!	<b></b><br />You may be looking for a property right in town? Well they are few and far between these days. This property is full of investment potential.... you could call it a renovators delight.... however there are not many options left if you are ...	[]	40-42-roadknight-street-lakes-entrance-vic-3909-2014909823
91	2014971399	Agency	28162	CONTACT	CONTACT	CONTACT	['AirConditioning', 'BuiltInWardrobes', 'SecureParking', 'Heating']	House	2.0	4.0	4	Melbourne Region	TARNEIT	3029	42 Babele Road, Tarneit	-37.8487129	144.660309	IMMACULATE FAMILY SIZED ENTERTAINER !!	<b></b><br />Ideally located only 25 Kms (approx) from Melbourne CBD & only a few minutes' drive to Tarneit train station, shopping centres, easy freeway access, close to all basic amenities. There is nothing left for you to do but to sit back, relax a...	[]	42-babele-road-tarneit-vic-3029-2014971399
92	2015546463	Agency	11947	$545,000 - $565,000	545000	565000	['AirConditioning', 'BuiltInWardrobes', 'Ensuite', 'SecureParking', 'Heating', 'Dishwasher', 'Shed', 'FullyFenced', 'SolarHotWater', 'SolarPanels']	House	2.0	4.0	4	Melbourne Region	CLIFTON SPRINGS	3222	103 Bayshore Avenue, Clifton Springs	-38.15754	144.560272	PRIME LIFESTYLE POSITION	<b></b><br />Located only a few minutes from the water and local golf club precinct with public transport nearby. Pop in to the various wineries and cafes located only a short drive away or jump on the Port Phillip Ferry for a day in the city. This lov...	['Under offer']	103-bayshore-avenue-clifton-springs-vic-3222-2015546463
93	2015024054	Agency	30182	$550,000 - $590,000	550000	590000	['AirConditioning', 'BuiltInWardrobes', 'Ensuite', 'SecureParking', 'SwimmingPool', 'Heating', 'Dishwasher', 'Shed']	House	2.0	3.0	3	Melbourne Region	HOPPERS CROSSING	3029	118 Grevillea Crescent, Hoppers Crossing	-37.85871	144.7132	Potential sub-division STCA (Approx. 670m² Land) at Prime location..!!	"<b></b><br />Gold Key Real Estate proudly presenting a rare opportunity to buy a home that is in immaculate condition! Located in well known Kingston Estate close to bus stop, train station, Werribee Plaza, good schools, community centres etc..

Only..."	[]	118-grevillea-crescent-hoppers-crossing-vic-3029-2015024054
94	2015505316	Agency	22880	$550000 to $595000	550000	595000	['AirConditioning', 'BuiltInWardrobes', 'Ensuite', 'Gas', 'InternalLaundry', 'SecureParking', 'SwimmingPool', 'GroundFloor', 'Gym', 'AlarmSystem', 'BroadbandInternetAccess', 'SeparateDiningRoom', 'Heating', 'FullyFenced', 'SolarHotWater', 'GardenCourtyard']	House	3.0	4.0	4	Melbourne Region	POINT COOK	3030	145 Beachview Parade, Point Cook	-37.90728	144.763779	Luxury  Single Storey 4 Bedrooms Family Home at Sanctuary Lakes	<b></b><br />This Luxury Single Storey house is located in the beautifully Sanctuary Lakes upmarket Estate. It offers resort living lifestyle with access to Golf Course*, gym facilities*, bistro et al.  All this and more located only 20 kms from Melbou...	[]	145-beachview-parade-point-cook-vic-3030-2015505316
95	2014045821	Agency	27443	$549,000	549000		['Ensuite', 'Gas', 'SecureParking', 'SwimmingPool', 'Heating', 'Study', 'Shed', 'SolarHotWater', 'SolarPanels']	House	2.0	4.0	4	Northern Victoria	HORSHAM	3400	220 Golf Course Road, Horsham	-36.737854	142.194946	Energy Saving Family Home with extra Shedding	<b></b><br />Positioned only 700m to the Horsham Golf Course is this fantastic lifestyle package that offers space for a growing family, excellent extra shedding and more than enough space to put a swimming pool. Sitting on a generous 5387m2 approx all...	[]	220-golf-course-road-horsham-vic-3400-2014045821
